{
  "constraint_sets": {
    "calibration_pack_version": "pack_v1",
    "constraints_compiled_sha256": "a89969f1b39518f9c0f55706bbeee0cbddf8055a0e4baa529138bf4135d651f1",
    "constraints_ruleset": "constraints_v1",
    "constraints_version": "v1",
    "redteam_pack_version": "pack_v1",
    "window_policy_version": "v1"
  },
  "core": {
    "name": "Aletheia_v1_Practical_Core",
    "sha256": "641f14f84bebd1cc45ae6437c4b9b72600def12a3a24a4bf667343db2375dd6e",
    "version": "v1_4"
  },
  "created_utc": "REPLACE_ME_UTC",
  "model_adapter": {
    "capability_contract": "none",
    "name": "none",
    "version": "none"
  },
  "packs": {
    "calibration_pack": "pack_v1",
    "redteam_pack": "pack_v1"
  },
  "schema_version": "1",
  "schemas": {
    "provenance_envelope": "v1",
    "redteam_case": "v1",
    "refusal_reason": "v1",
    "structured_answer": "v1",
    "structured_question": "v1",
    "tool_approval": "v1",
    "tool_plan": "v1"
  },
  "tool_policy": {
    "allowlist": [],
    "budgets": {}
  },
  "tooling": {
    "drift_detector": {
      "checks": [
        "DRIFT_VALIDATE_MANIFEST",
        "DRIFT_CALIBRATION_PACK",
        "DRIFT_REDTEAM_PACK",
        "DRIFT_CONSTRAINTS_ON_SAMPLE_ANSWER",
        "DRIFT_REPLAY_SAMPLE_ENV"
      ],
      "drift_report_schema_version": "1",
      "version": "v1"
    },
    "replay_engine": {
      "replay_report_schema_version": "1",
      "supports_chain": true,
      "version": "v1"
    },
    "self_diagnostic": {
      "checks": [
        "CHK_SCHEMA_STRUCTURED_ANSWER",
        "CHK_CONSTRAINTS_COMPILED",
        "CHK_SCHEMA_PROVENANCE_ENVELOPE",
        "CHK_CASE_VERIFY"
      ],
      "trace_schema_version": "1",
      "version": "v1"
    },
    "tool_runner": {
      "budgets_enforced": true,
      "ops_allowlist": [
        "COPY",
        "MOVE",
        "DELETE",
        "MKDIR"
      ],
      "requires_approval": true,
      "version": "v1",
      "workspace_only": true
    }
  }
}